ticker,published_at,direction,text,source,fetched_at
AA,2026-07-17T18:50:26Z,UNKNOWN,AA Stock Dips as Alcoa Cuts Aluminum Production Guidance,yfinance,2026-07-22T12:20:48.089065Z
ABT,2026-07-21T13:47:00Z,UNKNOWN,"Boston Scientific's Q2 Earnings Coming Up: Buy, Hold or Sell the Stock?",yfinance,2026-07-22T12:20:48.089065Z
ACVA,2026-06-07T04:20:10Z,UNKNOWN,Why ACV Auctions (ACVA) Is Down 13.9% After Softer Guidance Amid Rising Rates And Governance Focus,yfinance,2026-07-22T12:20:48.089065Z
ADC,2026-06-11T14:44:00Z,UNKNOWN,O Raises the Payout: Can the Monthly Dividend Still Win Investors?,yfinance,2026-07-22T12:20:48.089065Z
ADC,2026-05-15T16:50:00Z,UNKNOWN,"Is Realty Income Stock a Buy After Q1 Results, or Still a Hold Now?",yfinance,2026-07-22T12:20:48.089065Z
ADNT,2026-05-20T15:53:00Z,UNKNOWN,Here's Why You Should Retain Adient Stock in Your Portfolio Now,yfinance,2026-07-22T12:20:48.089065Z
ADP,2026-07-14T02:09:11Z,UNKNOWN,"Automatic Data Processing (ADP) Draws Q4 Attention, Is The Upside Already Priced In?",yfinance,2026-07-22T12:20:48.089065Z
ADP,2026-07-13T15:04:24Z,UNKNOWN,"Automatic Data Processing Set to Deliver Modest Fiscal Q4 Beat, RBC Says",yfinance,2026-07-22T12:20:48.089065Z
ADV,2026-06-08T11:39:56Z,UNKNOWN,Exploring 3 Undervalued Small Caps With Insider Buying Across Regions,yfinance,2026-07-22T12:36:44.305953Z
AEBI,2026-05-12T17:35:51Z,UNKNOWN,Top Growth Companies With Strong Insider Ownership In May 2026,yfinance,2026-07-22T12:36:44.305953Z
AEE,2026-07-20T17:40:00Z,UNKNOWN,"Zacks Industry Outlook Highlights NextEra Energy, Duke Energy, American Electric Power and Ameren",yfinance,2026-07-22T12:36:44.305953Z
AEE,2026-07-15T16:55:00Z,UNKNOWN,Here's Why Investors Should Add NI to Their Portfolio Right Now,yfinance,2026-07-22T12:36:44.305953Z
AEE,2026-07-04T13:16:32Z,UNKNOWN,Does Ameren’s Brighter Analyst Sentiment Reshape the Core Investment Case Around Its Dividend Reliability (AEE)?,yfinance,2026-07-22T12:36:44.305953Z
AEHR,2026-07-22T03:17:10Z,UNKNOWN,Aehr Test (AEHR) Rockets 27.9% on 3x Revenue Growth Outlook,yfinance,2026-07-22T12:36:44.305953Z
AEHR,2026-07-19T08:47:20Z,UNKNOWN,Aehr Test (AEHR) Rockets as Traders Buy Into Triple Revenue Growth Outlook,yfinance,2026-07-22T12:36:44.305953Z
AEHR,2026-07-17T16:05:00Z,UNKNOWN,"Aehr Test Systems Stock Soars on Earnings, Eyes Over 150% Revenue Growth",yfinance,2026-07-22T12:36:44.305953Z
AEHR,2026-07-17T05:49:50Z,UNKNOWN,This Semiconductor Stock Is Up 4X This Year – And Analysts Think The Rally Has More Room,yfinance,2026-07-22T12:36:44.305953Z
AEHR,2026-07-16T14:12:57Z,UNKNOWN,Why Aehr Test Systems (AEHR) Is Up 29.3% After AI-Fueled 2027 Revenue Guidance And Record Backlog,yfinance,2026-07-22T12:36:44.305953Z
AEIS,2026-07-06T12:05:00Z,UNKNOWN,Analysts Just Raised Price Targets On These 3 Semiconductor Equipment Stocks,yfinance,2026-07-22T12:36:44.305953Z
AEIS,2026-07-02T13:08:24Z,UNKNOWN,3 Unpopular Stocks We Find Risky,yfinance,2026-07-22T12:36:44.305953Z
AEM,2026-07-15T13:02:00Z,UNKNOWN,Newmont Stock Slides 16% in 3 Months: Here's How to Play the Stock,yfinance,2026-07-22T12:36:44.305953Z
AEP,2026-07-20T17:40:00Z,UNKNOWN,"Zacks Industry Outlook Highlights NextEra Energy, Duke Energy, American Electric Power and Ameren",yfinance,2026-07-22T12:36:44.305953Z
AEP,2026-07-16T11:57:18Z,UNKNOWN,"Here Are Thursday’s Top Wall Street Analyst Research Calls: Alphabet, BlackRock, Etsy, Flex, Lululemon Athletica, Meta Platforms, Okta, Palo Alto Networks, and More",yfinance,2026-07-22T12:36:44.305953Z
AERO,2026-04-23T23:08:40Z,UNKNOWN,Grupo Aeromexico Q1 Earnings Call Highlights,yfinance,2026-07-22T12:36:44.305953Z
AFL,2026-07-02T13:08:24Z,UNKNOWN,3 Unpopular Stocks We Find Risky,yfinance,2026-07-22T12:36:44.305953Z
AFYA,2026-06-11T11:32:10Z,UNKNOWN,3 Top Dividend Stocks To Consider For Your Portfolio,yfinance,2026-07-22T12:36:44.305953Z
AG,2026-07-11T19:08:29Z,UNKNOWN,Is First Majestic Silver's (TSX:AG) Bigger 2026 Bet Reframing Its Entire Capital Allocation Playbook?,yfinance,2026-07-22T12:36:44.305953Z
AG,2026-07-11T17:07:17Z,UNKNOWN,First Majestic Silver (TSX:AG) Appoints CFO As 2026 Production Outlook Jumps,yfinance,2026-07-22T12:36:44.305953Z
AG,2026-07-11T08:16:41Z,UNKNOWN,"First Majestic Silver (TSX:AG) Lifted Guidance, Is The Stock Still Cheap?",yfinance,2026-07-22T12:36:44.305953Z
AG,2026-07-09T14:23:00Z,UNKNOWN,"AG's Q2 Silver Production Jumps 3% Y/Y, 2026 Production View Hiked",yfinance,2026-07-22T12:36:44.305953Z
AGCC,2026-04-20T11:33:17Z,UNKNOWN,US Market's Hidden Gems: 3 Promising Small Caps,yfinance,2026-07-22T12:36:44.305953Z
AGI,2026-06-23T17:54:26Z,UNKNOWN,Here is Why Alamos Gold (AGI) is One of the Most Profitable Undervalued Stocks to Invest In,yfinance,2026-07-22T12:36:44.305953Z
AGI,2026-06-23T10:14:27Z,UNKNOWN,Is Alamos Gold (TSX:AGI) Trading Near-Term Output For Longer-Term Grade Upside Potential?,yfinance,2026-07-22T12:36:44.305953Z
AGI,2026-06-22T14:05:00Z,UNKNOWN,Can ORLA Stay on Track After Camino Rojo's Brief Production Halt?,yfinance,2026-07-22T12:36:44.305953Z
AGM,2026-07-01T12:57:00Z,UNKNOWN,"Zacks Industry Outlook Highlights Federal Agricultural Mortgage, Lending Tree and Finance of America",yfinance,2026-07-22T12:36:44.305953Z
AGNC,2026-07-18T18:08:33Z,UNKNOWN,How AGNC’s July Dividend and Earnings Timing Could Shape AGNC Investment (AGNC) Investors’ Outlook,yfinance,2026-07-22T12:36:44.305953Z
AGNT,2026-07-11T04:14:43Z,UNKNOWN,AGNT (AGNT) Stock Fair Value Moves Lower After Analysts Cut Growth Expectations,yfinance,2026-07-22T12:36:44.305953Z
AGNT,2026-06-10T18:05:05Z,UNKNOWN,3 Penny Stocks With Market Caps Up To $800M,yfinance,2026-07-22T12:36:44.305953Z
AGNT,2026-06-07T08:11:36Z,UNKNOWN,How The Narrative Around eXp World Holdings (EXPI) Is Evolving Without Fresh Analyst Guidance,yfinance,2026-07-22T12:36:44.305953Z
AGO,2026-06-23T10:32:46Z,UNKNOWN,1 of Wall Street’s Favorite Stocks on Our Buy List and 2 We Brush Off,yfinance,2026-07-22T12:36:44.305953Z
AGRO,2026-06-12T14:51:00Z,UNKNOWN,"Zacks Industry Outlook Highlights Corteva, Archer Daniels Midland, The Scotts, Miracle-Gro, Adecoagro and Mission Produce",yfinance,2026-07-22T12:36:44.305953Z
AGX,2026-07-15T14:42:00Z,UNKNOWN,Can Argan's Record Q1 Results Keep the Stock on Its Winning Path?,yfinance,2026-07-22T12:36:44.305953Z
AGYS,2026-07-07T09:31:00Z,UNKNOWN,"Zacks Industry Outlook Highlights Micron, Seagate, Hewlett Packard and Agilysys",yfinance,2026-07-22T12:36:44.305953Z
AI,2026-07-17T09:53:46Z,UNKNOWN,3 Unpopular Stocks Walking a Fine Line,yfinance,2026-07-22T12:36:44.305953Z
AIN,2026-07-02T14:36:24Z,UNKNOWN,1 Unpopular Stock That Deserves a Second Chance and 2 Facing Headwinds,yfinance,2026-07-22T12:36:44.305953Z
AIN,2026-06-04T10:10:08Z,UNKNOWN,Assessing Albany International (AIN) Valuation After Q1 Earnings Beat And Progress On Profitable Growth,yfinance,2026-07-22T12:36:44.305953Z
AIN,2026-05-12T19:28:48Z,UNKNOWN,Is Albany International (AIN) Trading Margin for Growth as Revenue Rises but EPS Softens?,yfinance,2026-07-22T12:36:44.305953Z
AIOT,2026-06-23T15:36:50Z,UNKNOWN,"Strong Results, Lower Target: What’s Happening at PowerFleet, Inc. (AIOT)",yfinance,2026-07-22T12:36:44.305953Z
AIOT,2026-06-15T14:03:34Z,UNKNOWN,Powerfleet Shares Jump on Strong Fiscal 2027 Outlook Despite Earnings Miss (AIOT),yfinance,2026-07-22T12:36:44.305953Z
AIR,2026-07-21T20:49:48Z,UNKNOWN,"AAR (NYSE:AIR) Reports Strong Q2 CY2026, Next Quarter’s Sales Guidance is Optimistic",yfinance,2026-07-22T12:36:44.305953Z
AIR,2026-07-09T13:25:00Z,UNKNOWN,2 Unpopular Stocks That Deserve a Second Chance and 1 We Find Risky,yfinance,2026-07-22T12:36:44.305953Z
AKR,2026-06-23T03:43:06Z,UNKNOWN,"Truist Raises Acadia Realty Trust (AKR) Price Target, Citing Strong Earnings Growth Outlook",yfinance,2026-07-22T13:36:55.524039Z
ALB,2026-07-16T15:51:00Z,UNKNOWN,MP Materials Stock Outlook Hinges on Rare Earth Scale-Up Plans,yfinance,2026-07-22T13:36:55.524039Z
ALG,2026-06-19T15:56:58Z,UNKNOWN,3 of Wall Street’s Favorite Stocks with Warning Signs,yfinance,2026-07-22T13:36:55.524039Z
ALGT,2026-07-06T15:18:12Z,UNKNOWN,"Airline Stocks Set to Hit or Beat High End of Q2 Guidance, Morgan Stanley Says",yfinance,2026-07-22T13:36:55.524039Z
ALK,2026-07-22T12:48:25Z,UNKNOWN,Alaska Air Fuel Costs Surge 85% as Q3 EPS Outlook Misses Expectations,yfinance,2026-07-22T13:36:55.524039Z
ALK,2026-07-22T11:03:09Z,UNKNOWN,"Alaska Air Issues Downbeat Earnings Outlook, Swings to Second-Quarter Loss",yfinance,2026-07-22T13:36:55.524039Z
ALK,2026-07-21T21:19:46Z,UNKNOWN,Jet-Fuel Prices Rear Up Again at Alaska Air,yfinance,2026-07-22T13:36:55.524039Z
ALKT,2026-07-06T17:21:24Z,UNKNOWN,Activist Investor Jana Partners Pushes Alkami (ALKT) Toward a Potential Sale,yfinance,2026-07-22T13:36:55.524039Z
ALKT,2026-06-15T17:39:07Z,UNKNOWN,3 Stocks Estimated To Be Up To 46.2% Below Fair Value Offering A 12.2% Discount Opportunity,yfinance,2026-07-22T13:36:55.524039Z
ALKT,2026-06-12T17:38:00Z,UNKNOWN,3 Stocks Estimated To Be Up To 47.8% Below Intrinsic Value,yfinance,2026-07-22T13:36:55.524039Z
ALKT,2026-06-12T11:38:02Z,UNKNOWN,3 Stocks That Might Be Up To 39.8% Below Their Estimated Intrinsic Value,yfinance,2026-07-22T13:36:55.524039Z
ALLE,2026-07-22T09:11:40Z,UNKNOWN,Is Allegion (ALLE) Undervalued As Earnings Expectations Come Into Focus?,yfinance,2026-07-22T13:36:55.524039Z
ALLE,2026-07-21T13:15:04Z,UNKNOWN,Countdown to Allegion (ALLE) Q2 Earnings: Wall Street Forecasts for Key Metrics,yfinance,2026-07-22T13:36:55.524039Z
ALLE,2026-07-20T17:46:00Z,UNKNOWN,"Zacks Industry Outlook Highlights Allegion, MSA Safety, ADT and Alarm.com",yfinance,2026-07-22T13:36:55.524039Z
ALLY,2026-07-21T13:44:49Z,UNKNOWN,Ally Financial misses second-quarter earnings forecasts despite higher revenue and profit (ALLY),yfinance,2026-07-22T13:36:55.524039Z
ALNT,2026-07-14T10:55:11Z,UNKNOWN,3 Unpopular Stocks Walking a Fine Line,yfinance,2026-07-22T13:36:55.524039Z
ALNY,2026-07-14T14:50:35Z,UNKNOWN,"Alnylam Pharmaceuticals' Q2 Results to Determine 2026 Revenue Outlook, BofA Securities Says",yfinance,2026-07-22T13:36:55.524039Z
ALRM,2026-07-20T17:46:00Z,UNKNOWN,"Zacks Industry Outlook Highlights Allegion, MSA Safety, ADT and Alarm.com",yfinance,2026-07-22T13:36:55.524039Z
ALV,2026-07-21T14:24:00Z,UNKNOWN,"GM Q2 Earnings Beat on Pricing and Cost Discipline, '26 View Raised",yfinance,2026-07-22T13:36:55.524039Z
ALV,2026-07-17T23:53:46Z,UNKNOWN,Why Autoliv (ALV) Stock Is Trading Lower Today,yfinance,2026-07-22T13:36:55.524039Z
AMAT,2026-07-21T20:25:49Z,UNKNOWN,"Stocks to Watch: GM, BAE Systems, Novartis, Swatch",yfinance,2026-07-22T13:36:55.524039Z
AMAT,2026-07-21T19:10:26Z,UNKNOWN,Why Applied Materials (AMAT) Stock Is Up Today,yfinance,2026-07-22T13:36:55.524039Z
AMAT,2026-07-21T08:57:00Z,UNKNOWN,"Zacks Industry Outlook Highlights Applied Materials, Lam Research and FormFactor",yfinance,2026-07-22T13:36:55.524039Z
AMBA,2026-07-02T15:14:30Z,UNKNOWN,Why Ambarella (AMBA) Is Up 40.2% After Record Auto AI Sales And Profit Turnaround – And What's Next,yfinance,2026-07-22T13:36:55.524039Z
AMBP,2026-04-27T17:38:23Z,UNKNOWN,"Ardagh Metal Packaging's Q1 'Beat' Signals Positive Read-Throughs for Peers, RBC Says",yfinance,2026-07-22T13:36:55.524039Z
AMBP,2026-04-23T23:08:40Z,UNKNOWN,Ardagh Metal Packaging Q1 Earnings Call Highlights,yfinance,2026-07-22T13:36:55.524039Z
AMG,2026-07-10T03:22:55Z,UNKNOWN,Affiliated Managers Group (AMG) Rises After Earnings As Valuation Questions Follow,yfinance,2026-07-22T13:36:55.524039Z
AMGN,2026-07-21T20:04:42Z,UNKNOWN,Eli Lilly Stock And The Price Of Confidence,yfinance,2026-07-22T13:36:55.524039Z
AMH,2026-05-26T16:16:00Z,UNKNOWN,5 Reasons Invitation Homes Stock Looks Worth Buying Now,yfinance,2026-07-22T13:36:55.524039Z
AMN,2026-07-06T11:16:01Z,UNKNOWN,3 Unpopular Stocks We Keep Off Our Radar,yfinance,2026-07-22T13:36:55.524039Z
AMP,2026-07-20T13:15:06Z,UNKNOWN,Ameriprise (AMP) Q2 Earnings on the Horizon: Analysts' Insights on Key Performance Measures,yfinance,2026-07-22T13:36:55.524039Z
AMR,2026-05-22T02:16:15Z,UNKNOWN,How The Amarin (AMRN) Story Is Shifting With A Refined Fair Value And Outlook,yfinance,2026-07-22T13:36:55.524039Z
AMR,2026-05-09T16:18:04Z,UNKNOWN,Assessing Alpha Metallurgical Resources (AMR) Valuation After Q1 2026 Loss And Reaffirmed Guidance,yfinance,2026-07-22T13:36:55.524039Z
AMRC,2026-06-15T13:32:07Z,UNKNOWN,3 of Wall Street’s Favorite Stocks with Questionable Fundamentals,yfinance,2026-07-22T13:36:55.524039Z
AMRZ,2026-05-01T05:06:26Z,UNKNOWN,Amrize Q1 Earnings Call Highlights,yfinance,2026-07-22T13:36:55.524039Z
AMSC,2026-07-06T12:52:01Z,UNKNOWN,2 of Wall Street’s Favorite Stocks to Own for Decades and 1 That Underwhelm,yfinance,2026-07-22T13:36:55.524039Z
ANDG,2026-04-27T11:38:08Z,UNKNOWN,3 Stocks That Might Be Undervalued By Up To 32.8%,yfinance,2026-07-22T13:46:06.624129Z
ANDG,2026-04-01T17:38:11Z,UNKNOWN,3 Stocks That Investors Might Be Undervaluing Based On Current Market Estimates,yfinance,2026-07-22T13:46:06.624129Z
ANDG,2026-04-01T11:38:09Z,UNKNOWN,3 Stocks Estimated To Be Trading At A Discount Of Up To 36.2%,yfinance,2026-07-22T13:46:06.624129Z
AOS,2026-07-15T12:53:17Z,UNKNOWN,3 of Wall Street’s Favorite Stocks with Open Questions,yfinance,2026-07-22T13:46:06.624129Z
APC,2026-05-11T14:07:05Z,UNKNOWN,Anadarko Petroleum Q1 Earnings Call Highlights,yfinance,2026-07-22T13:46:06.624129Z
APC,2026-05-11T13:52:30Z,UNKNOWN,ARKO Petroleum (APC) Beats Q1 Expectations and Reaffirms 2026 Outlook,yfinance,2026-07-22T13:46:06.624129Z
APH,2026-07-20T20:09:00Z,UNKNOWN,"Top Analyst Reports for Johnson & Johnson, Lam Research & Seagate",yfinance,2026-07-22T13:46:06.624129Z
APOG,2026-06-30T10:45:00Z,UNKNOWN,"APOG Q1 Earnings Call Keeps Focus on Kalwall, Guidance",yfinance,2026-07-22T13:46:06.624129Z
APP,2026-07-16T18:50:16Z,UNKNOWN,Is Applovin Corp (APP) Stock a Buy Ahead of the Q2 Report?,yfinance,2026-07-22T13:46:06.624129Z
APP,2026-07-15T13:01:17Z,UNKNOWN,1 of Wall Street’s Favorite Stocks on Our Buy List and 2 We Brush Off,yfinance,2026-07-22T13:46:06.624129Z
APPS,2026-07-13T13:29:00Z,UNKNOWN,APPS' Ignite Platform Opens Doors: Can It Drive Revenue Growth?,yfinance,2026-07-22T13:46:06.624129Z
APTV,2026-07-10T10:39:11Z,UNKNOWN,Earnings Preview: What To Expect From Aptiv's Report,yfinance,2026-07-22T13:46:06.624129Z
AR,2026-06-08T19:09:21Z,UNKNOWN,Analyst Optimism Versus Insider Selling Could Be A Game Changer For Antero Resources (AR),yfinance,2026-07-22T13:46:06.624129Z
ARCO,2026-07-21T11:00:00Z,UNKNOWN,5 Value Stocks With Impressive EV-to-EBITDA Ratios to Own Now,yfinance,2026-07-22T13:46:06.624129Z
ARHS,2026-07-15T13:56:00Z,UNKNOWN,Arhaus Stock Outlook Hinges on Growth Plans and Demand Recovery,yfinance,2026-07-22T13:46:06.624129Z
ARHS,2026-07-08T08:10:44Z,UNKNOWN,1 Unpopular Stock That Should Get More Attention and 2 We Ignore,yfinance,2026-07-22T13:46:06.624129Z
ARHS,2026-06-15T17:20:00Z,UNKNOWN,RH’s Strong Q1 Still Leaves Investors With One Big Question,yfinance,2026-07-22T13:46:06.624129Z
ARLO,2026-07-10T13:19:20Z,UNKNOWN,1 of Wall Street’s Favorite Stocks to Research Further and 2 Facing Challenges,yfinance,2026-07-22T13:46:06.624129Z
ARLP,2026-06-26T08:52:00Z,UNKNOWN,"Zacks Industry Outlook Core Natural Resources, Alliance Resource Partners, and Ramaco",yfinance,2026-07-22T13:46:06.624129Z
ARM,2026-07-20T17:07:00Z,UNKNOWN,Arm receives higher price target from Jefferies on stronger AI-driven demand outlook,yfinance,2026-07-22T13:46:06.624129Z
AROC,2026-07-17T15:45:00Z,UNKNOWN,EQT Gears Up to Report Q2 Earnings: What's in Store for the Stock?,yfinance,2026-07-22T13:46:06.624129Z
